<?xml version="1.0" encoding="utf-8"?>
<Factions xmlns="OrientalEmpires" xmlns:xsi="http://www.w3.org/2001/XMLSchema-instance" xsi:schemaLocation="OrientalEmpires Factions.xsd">
  <!-- Huaxia Factions 
  <Capability Name = "Roof Tiles" Level = "1"/>
    <Capability Name = "Wall Construction" Level = "1"/>
    <Capability Name = "Road Building" Level = "1"/>
    <Capability Name = "Peasant Happiness" Level = "1"/>
    <Capability Name = "Noble Happiness" Level = "1"/>
    <Capability Name = "Peasant Unrest" Level = "1"/>
    <Capability Name = "Noble Unrest" Level = "1"/>
    <Capability Name = "Boost Thought" Level = "1"/>
    <Capability Name = "Boost Craft" Level = "1"/>
    <Capability Name = "Boost Power" Level = "1"/>
    <Capability Name = "Boost Knowledge" Level = "1"/>
    <Capability Name = "Reduce Thought" Level = "1"/>
    <Capability Name = "Reduce Power" Level = "1"/>
    <Capability Name = "Boost Military" Level = "1"/>
    <Capability Name = "Boost Culture" Level = "1"/>
    <Capability Name = "Boost Economy" Level = "1"/>
    <Capability Name = "Boost Agriculture" Level = "1"/>
    <Capability Name = "Reduce Agriculture" Level = "1"/>
    <Capability Name = "Boost Naval" Level = "1"/>
    <Capability Name = "Primitive" Level = "1"/>
    <Capability Name = "Authority" Level = "1"/>
    <Capability Name = "Culture" Level = "1"/>
    <Capability Name = "NewLeaderVirtue" Level = "1"/>
    <Capability Name = "NewLeaderEnergy" Level = "1"/>
    <Capability Name = "AgriculturalProduction" Level = "1"/>
    <Capability Name = "Battle Healing" Level = "1"/>
    <Capability Name = "Decreased Wall Cost" Level = "1"/>
    <Capability Name = "Capture Tech" Level = "1"/>
    <Capability Name = "Increase Trade" Level = "1"/>
    <Capability Name = "Recovery Rate" Level = "1"/>
    <Capability Name = "Decreased Wall Cost" Level = "1"/>
    <Capability Name = "Capture Tech" Level = "1"/>
    <Capability Name = "Increase Ship HP" Level = "1"/>
    <Capability Name = "Decreased Wall Cost" Level = "1"/>
    <Capability Name = "Capture Tech" Level = "1"/>
    <Capability Name = "Terror Tactics" Level = "1"/>
    <Capability Name = "Capture Tech" Level = "1"/>
    <Capability Name = "Morale Penalty" Level = "1"/>
    <Capability Name = "Looting Bonus" Level = "1"/>
    <Capability Name = "Reduced Noble Recruitment" Level = "1"/>
    <Capability Name = "Morale Bonus" Level = "1"/>
    <Capability Name = "Reduced Noble Recruitment" Level = "1"/>
    <Capability Name = "Accepts Bandits" Level = "1"/>
    <Capability Name = "Friendly To Rebels" Level = "1"/>
    <Capability Name = "Accepts Peasant Rebels" Level = "1"/>
    <Capability Name = "Increase Scholar Virtue" Level = "1"/>
    <Capability Name = "Increase General Virtue" Level = "1"/>
    <Capability Name = "Crossbow Skill" Level = "1"/>
    <Capability Name = "Forest Combat Skill" Level = "1"/>
    <Capability Name = "Bow Skill" Level = "1"/>
    <Capability Name = "Sword Skill" Level = "1"/>
    <Capability Name = "Cavalry Skill" Level = "1"/>
    <Capability Name = "Infantry Skill" Level = "1"/>
    <Capability Name = "Chariot Skill" Level = "1"/>
    <Capability Name = "Naval Skill" Level = "1"/>
    <Capability Name = "Melee Attack" Level = "1"/>
    <Capability Name = "Melee Defense" Level = "1"/>
    <Capability Name = "Character Armor" Level = "1"/>
    <Capability Name = "Agriculture" Level = "1"/>
    <Capability Name = "Pastoralism" Level = "1"/>
    <Capability Name = "Nomadism" Level = "1"/>
    <Capability Name = "AttackAdvantageIfCharging" Level = "1"/>
    <Capability Name = "DefenseAdvantageIfDefending" Level = "1"/>
    <Capability Name = "SilkTradeValue" Level = "1"/>
    <Capability Name = "CeramicsTradeValue" Level = "1"/>
    <Capability Name = "IronTradeValue" Level = "1"/>
    <Capability Name = "BronzeTradeValue" Level = "1"/>
    <Capability Name = "Seafaring" Level = "1"/>
    <Capability Name = "Oceanfaring" Level = "1"/>
    
    <Capability Name = "Character Armor" Level = "5"/>
    <Capability Name = "AttackAdvantageIfCharging" Level = "5"/>
    <Capability Name = "Looting Bonus" Level = "50"/>
    <Capability Name = "Boost Military" Level = "10"/>
    <Capability Name = "Boost Agriculture" Level = "25"/>
    <Capability Name = "Accepts Bandits" Level = "1"/>
    <Capability Name = "Friendly To Rebels" Level = "1"/>
    <Capability Name = "Accepts Peasant Rebels" Level = "1"/>
    <Capability Name = "Agriculture" Level = "1"/>
    <Capability Name = "Pastoralism" Level = "1"/>
    <Capability Name = "Nomadism" Level = "1"/>
    <Capability Name = "Reduced Noble Recruitment" Level = "1"/>
  -->
  <!-- Huaxia Factions -->
  <!-- Shang -->
  <Faction ID="Shang">
    <Data ColorSet="81" Symbol="OE_FactionSymbol_01" AltSymbol="OE_FactionSymbol_50" NameSet="Shang" PersonalNames="Chinese" Architecture="Chinese" PortraitSet="Chinese">
      <UnitSet Name="Chinese" MinEra="0" MaxEra="2" />
    </Data>
    <Initially Money="100000" LeadersIncome="0" Era="0" PreferredClimate="Northern China" />
    <BaseSelection Selectable="Any" FactionImage="OE_FE_FactionElement_Shang_01" />
    <Capability Name="Boost Power" Level="10" />
    <Capability Name="Boost Military" Level="5" />
    <Capability Name="Naval Skill" Level="1" />
    <Capability Name="Accepts Peasant Rebels" Level="1" />
    <Capability Name="Melee Attack" Level="10" />
    <Tech Item="Agriculture" />
    <Tag Name="Farmers" />
  </Faction>

  <!-- Zhou -->
  <Faction ID="Zhou">
    <Data ColorSet="0" Symbol="OE_FactionSymbol_12" AltSymbol="OE_FactionSymbol_51" NameSet="Zhou" PersonalNames="Chinese" Architecture="Chinese">
      <UnitSet Name="Chinese" MinEra="0" MaxEra="2" />
    </Data>
    <Initially Money="100000" LeadersIncome="0" Era="0" PreferredClimate="Northern China" />
    <BaseSelection Selectable="Any" FactionImage="OE_FE_FactionElement_Zhou_01" />
    <Capability Name="Increase Trade" Level="-10" />
    <Capability Name="Noble Happiness" Level="10" />
    <Capability Name="Crossbow Skill" Level="10" />
    <Capability Name="Cavalry Skill" Level="15" />
    <Capability Name="Chariot Skill" Level="-10" />
    <Capability Name="NewLeaderVirtue" Level="2" />
    <Tech Item="Agriculture" />
    <Tag Name="Farmers" />
  </Faction>

  <!-- Qin -->
  <Faction ID="Qin">
    <Data ColorSet="112" Symbol="OE_FactionSymbol_13" AltSymbol="OE_FactionSymbol_52" NameSet="Qin" PersonalNames="Chinese" Architecture="Chinese">
      <UnitSet Name="Chinese" MinEra="0" MaxEra="2" />
    </Data>
    <Initially Money="100000" LeadersIncome="0" Era="0" PreferredClimate="Northern China" />
    <BaseSelection Selectable="Any" FactionImage="OE_FE_FactionElement_Qin_01" />
    <Capability Name="CombatAdvantage" Level="10" />
    <Capability Name="Boost Power" Level="20" />
    <Capability Name="Reduce Thought" Level="20" />
    <Capability Name="Reduce Culture" Level="20" />
    <Tech Item="Agriculture" />
    <Tag Name="Farmers" />
  </Faction>

  <!-- Han -->
  <Faction ID="Han">
    <Data ColorSet="119" Symbol="OE_FactionSymbol_10" AltSymbol="OE_FactionSymbol_53" NameSet="Han" PersonalNames="Chinese" Architecture="Chinese">
      <UnitSet Name="Chinese" MinEra="0" MaxEra="2" />
    </Data>
    <Initially Money="100000" LeadersIncome="0" Era="0" PreferredClimate="Northern China" />
    <BaseSelection Selectable="Any" FactionImage="OE_FE_FactionElement_Han_01" />
    <Capability Name="Boost Culture" Level="5" />
    <Capability Name="Peasant Happiness" Level="10" />
    <Capability Name="Crossbow Skill" Level="20" />
    <Capability Name="CombatDisadvantage" Level="10" />
    <Tech Item="Agriculture" />
    <Tag Name="Farmers" />
  </Faction>

  <!-- Southern Chinese-->
  <!-- Chu -->
  <Faction ID="Chu">
    <Data ColorSet="100" Symbol="OE_FactionSymbol_07" AltSymbol="OE_FactionSymbol_54" NameSet="Chu" PersonalNames="Chinese" Architecture="Chinese">
      <UnitSet Name="Chinese" MinEra="0" MaxEra="2" />
    </Data>
    <Initially Money="100000" LeadersIncome="0" Era="0" PreferredClimate="Southern China" />
    <BaseSelection Selectable="Any" FactionImage="OE_FE_FactionElement_Chu_01" />
    <Capability Name="Naval Skill" Level="15" />
    <Capability Name="Peasant Happiness" Level="10" />
    <Capability Name="CombatDisadvantage" Level="10" />
    <Capability Name="Boost Agriculture" Level="25" />
    <Capability Name="Accepts Bandits" Level="1" />
    <Tech Item="Agriculture" />
    <Tag Name="Farmers" />
  </Faction>

  <!-- Wu -->
  <Faction ID="Wu">
    <Data ColorSet="126" Symbol="OE_FactionSymbol_06" AltSymbol="OE_FactionSymbol_55" NameSet="Wu" PersonalNames="Chinese" Architecture="Chinese">
      <UnitSet Name="Chinese" MinEra="0" MaxEra="2" />
    </Data>
    <Initially Money="100000" LeadersIncome="0" Era="0" PreferredClimate="Southern China" />
    <BaseSelection Selectable="Any" FactionImage="OE_FE_FactionElement_Wu_01" />
    <Capability Name="Sword Skill" Level="10" />
    <Capability Name="Naval Skill" Level="15" />
    <Capability Name="Poor Horses" Level="15" />
    <Tech Item="Agriculture" />
    <Tag Name="Farmers" />
  </Faction>

  <!-- Min -->
  <Faction ID="Min">
    <Data ColorSet="82" Symbol="OE_FactionSymbol_05" AltSymbol="OE_FactionSymbol_56" NameSet="Min" PersonalNames="Chinese" Architecture="Chinese">
      <UnitSet Name="Chinese" MinEra="0" MaxEra="2" />
    </Data>
    <Initially Money="100000" LeadersIncome="0" Era="0" PreferredClimate="Southern China" />
    <BaseSelection Selectable="Any" FactionImage="OE_FE_FactionElement_Yue_01" />
    <Capability Name="Forest Combat Skill" Level="20" />
    <Capability Name="Naval Skill" Level="15" />
    <Capability Name="Boost Naval" Level="20" />
    <Capability Name="Poor Horses" Level="15" />